{
  "$schema": "https://json-schema.org/draft/2020-12/schema",
  "$id": "https://booksversusmovies.com/schemas/pillar-brief.schema.json",
  "title": "Pillar Page Brief",
  "type": "object",
  "additionalProperties": false,
  "required": ["project", "page", "brief", "clusters", "qa"],
  "properties": {
    "project": {
      "type": "object",
      "additionalProperties": false,
      "required": ["site_name", "site_url", "primary_topic"],
      "properties": {
        "site_name": { "type": "string", "minLength": 1 },
        "site_url": { "type": "string", "format": "uri" },
        "primary_topic": { "type": "string", "minLength": 1 },
        "secondary_topics": {
          "type": "array",
          "items": { "type": "string", "minLength": 1 }
        }
      }
    },
    "page": {
      "type": "object",
      "additionalProperties": false,
      "required": ["slug", "h1", "title_tag", "meta_description", "search_intent", "audience"],
      "properties": {
        "slug": { "type": "string", "pattern": "^[a-z0-9]+(?:-[a-z0-9]+)*$" },
        "h1": { "type": "string", "minLength": 1 },
        "title_tag": { "type": "string", "minLength": 1, "maxLength": 70 },
        "meta_description": { "type": "string", "minLength": 1, "maxLength": 160 },
        "search_intent": { "type": "string", "enum": ["informational", "commercial", "navigational", "transactional"] },
        "audience": { "type": "string", "minLength": 1 },
        "tone": { "type": "string", "minLength": 1 }
      }
    },
    "brief": {
      "type": "object",
      "additionalProperties": false,
      "required": ["promise", "summary", "sections"],
      "properties": {
        "promise": { "type": "string", "minLength": 1 },
        "summary": { "type": "string", "minLength": 1 },
        "sections": {
          "type": "array",
          "minItems": 3,
          "items": {
            "type": "object",
            "additionalProperties": false,
            "required": ["section_id", "h2", "goal", "key_points"],
            "properties": {
              "section_id": { "type": "string", "minLength": 1 },
              "h2": { "type": "string", "minLength": 1 },
              "goal": { "type": "string", "minLength": 1 },
              "key_points": {
                "type": "array",
                "minItems": 1,
                "items": { "type": "string", "minLength": 1 }
              },
              "h3s": {
                "type": "array",
                "items": {
                  "type": "object",
                  "additionalProperties": false,
                  "required": ["h3", "goal"],
                  "properties": {
                    "h3": { "type": "string", "minLength": 1 },
                    "goal": { "type": "string", "minLength": 1 }
                  }
                }
              }
            }
          }
        }
      }
    },
    "clusters": {
      "type": "array",
      "items": {
        "type": "object",
        "additionalProperties": false,
        "required": ["slug", "h1", "intent", "relationship_to_pillar"],
        "properties": {
          "slug": { "type": "string", "pattern": "^[a-z0-9]+(?:-[a-z0-9]+)*$" },
          "h1": { "type": "string", "minLength": 1 },
          "intent": { "type": "string", "minLength": 1 },
          "relationship_to_pillar": { "type": "string", "minLength": 1 },
          "internal_links": {
            "type": "array",
            "items": { "type": "string", "minLength": 1 }
          }
        }
      }
    },
    "qa": {
      "type": "object",
      "additionalProperties": false,
      "required": ["min_score", "checks"],
      "properties": {
        "min_score": { "type": "integer", "minimum": 0, "maximum": 100 },
        "checks": {
          "type": "array",
          "minItems": 1,
          "items": {
            "type": "string",
            "enum": [
              "single_h1",
              "unique_intent",
              "no_cannibalization",
              "clear_internal_links",
              "seo_title_length",
              "meta_description_length",
              "reader_value",
              "outline_completeness"
            ]
          }
        }
      }
    },
    "publish": {
      "type": "object",
      "additionalProperties": false,
      "properties": {
        "target": { "type": "string", "minLength": 1 },
        "status": { "type": "string", "enum": ["draft", "ready", "published"] }
      }
    }
  }
}